Andre Miller, Washington Wizards
DeJuan Blair, Washington Wizards
Drew Gooden, Washington Wizards
Garrett Temple, Washington Wizards
John Wall, Washington Wizards
Kevin Seraphin, Washington Wizards
Marcin Gortat, Washington Wizards
Nene , Washington Wizards
Otto Porter, Washington Wizards
Paul Pierce, Washington Wizards
Rasual Butler, Washington Wizards
Al Jefferson, Charlotte Hornets
Bismack Biyombo, Charlotte Hornets
Brian Roberts, Charlotte Hornets
Cody Zeller, Charlotte Hornets
Gary Neal, Charlotte Hornets
Jannero Pargo, Charlotte Hornets
Kemba Walker, Charlotte Hornets
Marvin Williams, Charlotte Hornets
Michael Kidd-Gilchrist, Charlotte Hornets
PJ Hairston, Charlotte Hornets
Aaron Gordon, Orlando Magic
Ben Gordon, Orlando Magic
Dewayne Dedmon, Orlando Magic
Elfrid Payton, Orlando Magic
Evan Fournier, Orlando Magic
Kyle O'Quinn, Orlando Magic
Luke Ridnour, Orlando Magic
Nikola Vucevic, Orlando Magic
Tobias Harris, Orlando Magic
Andre Drummond, Detroit Pistons
Brandon Jennings, Detroit Pistons
Caron Butler, Detroit Pistons
Cartier Martin, Detroit Pistons
D.J. Augustin, Detroit Pistons
Gigi Datome, Detroit Pistons
Greg Monroe, Detroit Pistons
Jonas Jerebko, Detroit Pistons
Josh Smith, Detroit Pistons
Kyle Singler, Detroit Pistons
Alex Kirk, Cleveland Cavaliers
Anderson Varejao, Cleveland Cavaliers
Chris Crawford, Cleveland Cavaliers
Dion Waiters, Cleveland Cavaliers
Joe Harris, Cleveland Cavaliers
Kyrie Irving, Cleveland Cavaliers
LeBron James, Cleveland Cavaliers
Lou Amundson, Cleveland Cavaliers
Matthew Dellavedova, Cleveland Cavaliers
Mike Miller, Cleveland Cavaliers
Shane Edwards, Cleveland Cavaliers
Tristan Thompson, Cleveland Cavaliers
Al-Farouq Aminu, Dallas Mavericks
Brandan Wright, Dallas Mavericks
Chandler Parsons, Dallas Mavericks
Charlie Villanueva, Dallas Mavericks
Devin Harris, Dallas Mavericks
Dirk Nowitzki, Dallas Mavericks
Gal Mekel, Dallas Mavericks
Greg Smith, Dallas Mavericks
Jae Crowder, Dallas Mavericks
Jameer Nelson, Dallas Mavericks
Monta Ellis, Dallas Mavericks
Richard Jefferson, Dallas Mavericks
Tyson Chandler, Dallas Mavericks
Andrew Wiggins, Minnesota Timberwolves
Anthony Bennett, Minnesota Timberwolves
Chase Budinger, Minnesota Timberwolves
Corey Brewer, Minnesota Timberwolves
Glenn Robinson, Minnesota Timberwolves
Gorgui Dieng, Minnesota Timberwolves
Mo Williams, Minnesota Timberwolves
Nikola Pekovic, Minnesota Timberwolves
Thaddeus Young, Minnesota Timberwolves
Zach LaVine, Minnesota Timberwolves
Giannis Antetokounmpo, Milwaukee Bucks
Jabari Parker, Milwaukee Bucks
Jared Dudley, Milwaukee Bucks
Jerryd Bayless, Milwaukee Bucks
John Henson, Milwaukee Bucks
Kendall Marshall, Milwaukee Bucks
Khris Middleton, Milwaukee Bucks
Michael Eric, Milwaukee Bucks
O.J. Mayo, Milwaukee Bucks
Zaza Pachulia, Milwaukee Bucks
Andre Roberson, Oklahoma City Thunder
Anthony Morrow, Oklahoma City Thunder
Jeremy Lamb, Oklahoma City Thunder
Lance Thomas, Oklahoma City Thunder
Michael Jenkins, Oklahoma City Thunder
Perry Jones, Oklahoma City Thunder
Russell Westbrook, Oklahoma City Thunder
Sebastian Telfair, Oklahoma City Thunder
Serge Ibaka, Oklahoma City Thunder
Steven Adams, Oklahoma City Thunder
Talib Zanna, Oklahoma City Thunder
Amir Johnson, Toronto Raptors
Bruno Caboclo, Toronto Raptors
DeMar DeRozan, Toronto Raptors
Greg Stiemsma, Toronto Raptors
James Johnson, Toronto Raptors
Jonas Valanciunas, Toronto Raptors
Jordan Hamilton, Toronto Raptors
Kyle Lowry, Toronto Raptors
Landry Fields, Toronto Raptors
Louis Williams, Toronto Raptors
Patrick Patterson, Toronto Raptors
Terrence Ross, Toronto Raptors
Tyler Hansbrough, Toronto Raptors
Chris Andersen, Miami Heat
Chris Bosh, Miami Heat
Dwyane Wade, Miami Heat
James Ennis, Miami Heat
Luol Deng, Miami Heat
Mario Chalmers, Miami Heat
Norris Cole, Miami Heat
Shabazz Napier, Miami Heat
Shannon Brown, Miami Heat
Shawne Williams, Miami Heat
Aaron Craft, Golden State Warriors
Andre Iguodala, Golden State Warriors
Andrew Bogut, Golden State Warriors
Brandon Rush, Golden State Warriors
David Lee, Golden State Warriors
Draymond Green, Golden State Warriors
Harrison Barnes, Golden State Warriors
James Michael McAdoo, Golden State Warriors
Justin Holiday, Golden State Warriors
Klay Thompson, Golden State Warriors
Leandro Barbosa, Golden State Warriors
Stephen Curry, Golden State Warriors
Blake Griffin, Los Angeles Clippers
Chris Douglas-Roberts, Los Angeles Clippers
Chris Paul, Los Angeles Clippers
DeAndre Jordan, Los Angeles Clippers
Ekpe Udoh, Los Angeles Clippers
JJ Redick, Los Angeles Clippers
Jamal Crawford, Los Angeles Clippers
Jordan Farmar, Los Angeles Clippers
Matt Barnes, Los Angeles Clippers
Spencer Hawes, Los Angeles Clippers
Dahntay Jones, Utah Jazz
Dante Exum, Utah Jazz
Derrick Favors, Utah Jazz
Enes Kanter, Utah Jazz
Gordon Hayward, Utah Jazz
Ian Clark, Utah Jazz
Rodney Hood, Utah Jazz
Rudy Gobert, Utah Jazz
Steve Novak, Utah Jazz
Trevor Booker, Utah Jazz
Trey Burke, Utah Jazz
Mike Dunleavy, Chicago Bulls
Joakim Noah, Chicago Bulls
Jimmy Butler, Chicago Bulls
Kirk Hinrich, Chicago Bulls
Taj Gibson, Chicago Bulls
Nazr Mohammed, Chicago Bulls
Tony Snell, Chicago Bulls
Ronnie Brewer, Chicago Bulls
Mike James, Chicago Bulls
Gerald Henderson, Charlotte Hornets
DJ White, Charlotte Hornets
Luis Scola, Indiana Pacers
Roy Hibbert, Indiana Pacers
George Hill, Indiana Pacers
Solomon Hill, Indiana Pacers
Chris Copeland, Indiana Pacers
Donald Sloan, Indiana Pacers
Lavoy Allen, Indiana Pacers
Paul George, Indiana Pacers
Ian Mahinmi, Indiana Pacers
David West, Indiana Pacers
Maurice Harkless, Orlando Magic
Victor Oladipo, Orlando Magic
Doron Lamb, Orlando Magic
Andrew Nicholson, Orlando Magic
Evan Turner, Boston Celtics
Anthony Tolliver, Phoenix Suns
Will Cherry, Cleveland Cavaliers
Arron Afflalo, Denver Nuggets
Josh McRoberts, Miami Heat
Jimmer Fredette, New Orleans Pelicans
Carlos Boozer, Los Angeles Lakers
Bernard James, Dallas Mavericks
Tayshaun Prince, Memphis Grizzlies
Zach Randolph, Memphis Grizzlies
Marc Gasol, Memphis Grizzlies
Courtney Lee, Memphis Grizzlies
Mike Conley, Memphis Grizzlies
Nick Calathes, Memphis Grizzlies
Tony Allen, Memphis Grizzlies
Kosta Koufos, Memphis Grizzlies
Jon Leuer, Memphis Grizzlies
Beno Udrih, Memphis Grizzlies
DeMarre Carroll, Atlanta Hawks
Mike Scott, Atlanta Hawks
Pero Antic, Atlanta Hawks
Kyle Korver, Atlanta Hawks
Jeff Teague, Atlanta Hawks
Elton Brand, Atlanta Hawks
Shelvin Mack, Atlanta Hawks
Mike Muscala, Atlanta Hawks
Dennis Schroder, Atlanta Hawks
Paul Millsap, Atlanta Hawks
Brandon Knight, Milwaukee Bucks
Chris Wright, Milwaukee Bucks
Miroslav Raduljica, Milwaukee Bucks
Larry Sanders, Milwaukee Bucks
Jeremy Evans, Utah Jazz
Alec Burks, Utah Jazz
Diante Garrett, Utah Jazz
John Lucas III, Utah Jazz
Erik Murphy, Utah Jazz
Kevin Martin, Minnesota Timberwolves
Ricky Rubio, Minnesota Timberwolves
Ronny Turiaf, Minnesota Timberwolves
Robbie Hummel, Minnesota Timberwolves
Dante Cunningham, Minnesota Timberwolves
Othyus Jeffers, Minnesota Timberwolves
Terrence Jones, Houston Rockets
Dwight Howard, Houston Rockets
Troy Daniels, Houston Rockets
Patrick Beverley, Houston Rockets
Isaiah Canaan, Houston Rockets
Donatas Motiejunas, Houston Rockets
Josh Powell, Houston Rockets
Darius Miller, New Orleans Pelicans
Jeff Withey, New Orleans Pelicans
Alexis Ajinca, New Orleans Pelicans
Tyreke Evans, New Orleans Pelicans
Austin Rivers, New Orleans Pelicans
Melvin Ely, New Orleans Pelicans
Luke Babbitt, New Orleans Pelicans
Anthony Davis, New Orleans Pelicans
Eric Gordon, New Orleans Pelicans
James Southerland, New Orleans Pelicans
Kentavious Caldwell-Pope, Detroit Pistons
Peyton Siva, Detroit Pistons
Tony Mitchell, Detroit Pistons
Kevin Durant, Oklahoma City Thunder
Kendrick Perkins, Oklahoma City Thunder
Nick Collison, Oklahoma City Thunder
Reggie Jackson, Oklahoma City Thunder
Derek Fisher, Oklahoma City Thunder
Hasheem Thabeet, Oklahoma City Thunder
Wesley Johnson, Los Angeles Lakers
Ryan Kelly, Los Angeles Lakers
Jordan Hill, Los Angeles Lakers
Jodie Meeks, Los Angeles Lakers
Nick Young, Los Angeles Lakers
Robert Sacre, Los Angeles Lakers
MarShon Brooks, Los Angeles Lakers
Steve Nash, Los Angeles Lakers
Pau Gasol, Chicago Bulls
E'Twaun Moore, Chicago Bulls
Rodney Stuckey, Indiana Pacers
Samuel Dalembert, New York Knicks
Shane Larkin, New York Knicks
Vince Carter, Memphis Grizzlies
Ramon Sessions, Sacramento Kings
Omri Casspi, Sacramento Kings
Kevin Love, Cleveland Cavaliers
Shawn Marion, Cleveland Cavaliers
Chris Kaman, Portland Trail Blazers
Omer Asik, New Orleans Pelicans
Jeremy Lin, Los Angeles Lakers
Ronnie Price, Los Angeles Lakers
Ed Davis, Los Angeles Lakers
Wayne Ellington, Los Angeles Lakers
Robert Covington, Philadelphia 76ers
Jose Calderon, New York Knicks
Jeff Adrien, Minnesota Timberwolves
Kawhi Leonard, San Antonio Spurs
Aron Baynes, San Antonio Spurs
Tiago Splitter, San Antonio Spurs
Danny Green, San Antonio Spurs
Tony Parker, San Antonio Spurs
Manu Ginobili, San Antonio Spurs
Boris Diaw, San Antonio Spurs
Jeff Ayres, San Antonio Spurs
Patty Mills, San Antonio Spurs
Cory Joseph, San Antonio Spurs
Matt Bonner, San Antonio Spurs
Austin Daye, San Antonio Spurs
Damion James, San Antonio Spurs
Bradley Beal, Washington Wizards
Martell Webster, Washington Wizards
Al Harrington, Washington Wizards
Jeff Green, Boston Celtics
Brandon Bass, Boston Celtics
Kelly Olynyk, Boston Celtics
Avery Bradley, Boston Celtics
Phil Pressey, Boston Celtics
Chris Babb, Boston Celtics
Rajon Rondo, Boston Celtics
Jared Sullinger, Boston Celtics
Andray Blatche, Brooklyn Nets
Jason Collins, Brooklyn Nets
Jorge Gutierrez, Brooklyn Nets
Marquis Teague, Brooklyn Nets
Andrei Kirilenko, Brooklyn Nets
Mason Plumlee, Brooklyn Nets
Alan Anderson, Brooklyn Nets
Kevin Garnett, Brooklyn Nets
Joe Johnson, Brooklyn Nets
Mirza Teletovic, Brooklyn Nets
Deron Williams, Brooklyn Nets
Carrick Felix, Cleveland Cavaliers
Adonis Thomas, Philadelphia 76ers
Henry Sims, Philadelphia 76ers
James Anderson, Philadelphia 76ers
Michael Carter-Williams, Philadelphia 76ers
Elliot Williams, Philadelphia 76ers
Jarvis Varnado, Philadelphia 76ers
Hollis Thompson, Philadelphia 76ers
Tony Wroten, Philadelphia 76ers
Casper Ware, Philadelphia 76ers
Brandon Davies, Philadelphia 76ers
Arnett Moultrie, Philadelphia 76ers
Byron Mullens, Philadelphia 76ers
Shane Battier, Miami Heat
Udonis Haslem, Miami Heat
Toney Douglas, Miami Heat
Ray Allen, Miami Heat
Greg Oden, Miami Heat
Michael Beasley, Miami Heat
Justin Hamilton, Miami Heat
Rashard Lewis, Miami Heat
Greivis Vasquez, Toronto Raptors
Dwight Buycks, Toronto Raptors
Nando De Colo, Toronto Raptors
Charles Hayes, Toronto Raptors
J.R. Smith, New York Knicks
Amar'e Stoudemire, New York Knicks
Cole Aldrich, New York Knicks
Pablo Prigioni, New York Knicks
Iman Shumpert, New York Knicks
Tim Hardaway Jr., New York Knicks
Jeremy Tyler, New York Knicks
Carmelo Anthony, New York Knicks
Glen Davis, Los Angeles Clippers
Reggie Bullock, Los Angeles Clippers
Hedo Turkoglu, Los Angeles Clippers
Nicolas Batum, Portland Trail Blazers
Dorell Wright, Portland Trail Blazers
Robin Lopez, Portland Trail Blazers
Wesley Matthews, Portland Trail Blazers
Damian Lillard, Portland Trail Blazers
CJ McCollum, Portland Trail Blazers
Chris Johnson, Philadelphia 76ers
CJ Miles, Indiana Pacers
Jarrett Jack, Brooklyn Nets
Sergey Karasev, Brooklyn Nets
Joel Anthony, Detroit Pistons
Kris Humphries, Washington Wizards
Darren Collison, Sacramento Kings
Ryan Hollins, Sacramento Kings
James Jones, Cleveland Cavaliers
Alonzo Gee, Denver Nuggets
Trevor Ariza, Houston Rockets
John Salmons, New Orleans Pelicans
Toure Murry, Utah Jazz
Raymond Felton, Dallas Mavericks
Joel Freeland, Portland Trail Blazers
Earl Watson, Portland Trail Blazers
Thomas Robinson, Portland Trail Blazers
Will Barton, Portland Trail Blazers
Meyers Leonard, Portland Trail Blazers
Allen Crabbe, Portland Trail Blazers
Victor Claver, Portland Trail Blazers
PJ Tucker, Phoenix Suns
Miles Plumlee, Phoenix Suns
Gerald Green, Phoenix Suns
Eric Bledsoe, Phoenix Suns
Markieff Morris, Phoenix Suns
Alex Len, Phoenix Suns
Marcus Morris, Phoenix Suns
Archie Goodwin, Phoenix Suns
Shavlik Randolph, Phoenix Suns
Dionte Christmas, Phoenix Suns
Goran Dragic, Phoenix Suns
Rudy Gay, Sacramento Kings
Derrick Williams, Sacramento Kings
Jason Thompson, Sacramento Kings
Ben McLemore, Sacramento Kings
Ray McCallum, Sacramento Kings
Travis Outlaw, Sacramento Kings
Aaron Gray, Sacramento Kings
DeMarcus Cousins, Sacramento Kings
Reggie Evans, Sacramento Kings
Willie Reed, Sacramento Kings
Marreese Speights, Golden State Warriors
Hilton Armstrong, Golden State Warriors
Ognjen Kuzmic, Golden State Warriors
Jordan Crawford, Golden State Warriors
Nemanja Nedovic, Golden State Warriors
Quincy Miller, Denver Nuggets
Kenneth Faried, Denver Nuggets
Timofey Mozgov, Denver Nuggets
Randy Foye, Denver Nuggets
Wilson Chandler, Denver Nuggets
Jan Vesely, Denver Nuggets
Anthony Randolph, Denver Nuggets
Darrell Arthur, Denver Nuggets
Danilo Gallinari, Denver Nuggets
Ty Lawson, Denver Nuggets
Nate Robinson, Denver Nuggets
Julyan Stone, Toronto Raptors
Tim Duncan, San Antonio Spurs
Marco Belinelli, San Antonio Spurs
James Harden, Houston Rockets
Francisco Garcia, Houston Rockets
Jermaine O'Neal, Golden State Warriors
CJ Watson, Indiana Pacers
Tornike Shengelia, Chicago Bulls
LaMarcus Aldridge, Portland Trail Blazers
Chris Singleton, Washington Wizards
Jamaal Franklin, Memphis Grizzlies
JJ Hickson, Denver Nuggets
Scotty Hopson, Cleveland Cavaliers
Shabazz Muhammad, Minnesota Timberwolves
James Nunnally, Philadelphia 76ers
Ersan Ilyasova, Milwaukee Bucks
Nate Wolters, Milwaukee Bucks
DJ Stephens, Milwaukee Bucks
Reggie Williams, Oklahoma City Thunder
Xavier Henry, Los Angeles Lakers
Will Bynum, Detroit Pistons
Seth Curry, Cleveland Cavaliers
Royce White, Sacramento Kings
Mustafa Shakur, Oklahoma City Thunder
Derrick Rose, Chicago Bulls
Darius Johnson-Odom, Philadelphia 76ers
Jason Richardson, Philadelphia 76ers
Ryan Anderson, New Orleans Pelicans
Earl Clark, New York Knicks
Orlando Johnson, Sacramento Kings
Andrew Bynum, Indiana Pacers
Eric Maynor, Philadelphia 76ers
Andris Biedrins, Utah Jazz
Tony Mitchell, Milwaukee Bucks
DeAndre Liggins, Miami Heat
Arinze Onuaku, Cleveland Cavaliers
Lorenzo Brown, Philadelphia 76ers
Gerald Wallace, Boston Celtics
Viacheslav Kravtsov, Phoenix Suns
Aaron Brooks, Chicago Bulls
Jason Smith, New York Knicks
Ish Smith, Oklahoma City Thunder
Isaiah Thomas, Phoenix Suns
Steve Blake, Portland Trail Blazers
Jared Cunningham, Los Angeles Clippers
Danny Granger, Miami Heat
Shaun Livingston, Golden State Warriors
Dexter Pittman, Atlanta Hawks
Gustavo Ayon, Atlanta Hawks
Glen Rice Jr., Washington Wizards
Carl Landry, Sacramento Kings
Josh Harrellson, Detroit Pistons
Kenyon Martin, New York Knicks
Metta World Peace, New York Knicks
Dexter Pittman, Atlanta Hawks
Jrue Holiday, New Orleans Pelicans
Festus Ezeli, Golden State Warriors
Antawn Jamison, Los Angeles Clippers
Darius Morris, Memphis Grizzlies
Chauncey Billups, Detroit Pistons
Sasha Vujacic, Los Angeles Clippers
Manny Harris, Los Angeles Lakers
Vitor Faverani, Boston Celtics
Ricky Ledo, Dallas Mavericks
Vander Blue, Boston Celtics
Roger Mason Jr., Miami Heat
Royal Ivey, Oklahoma City Thunder
Andrea Bargnani, New York Knicks
Keith Bogans, Boston Celtics
Tyshawn Taylor, Brooklyn Nets
Jeff Taylor, Charlotte Hornets
Cartier Martin, Chicago Bulls
Maalik Wayns, Los Angeles Clippers
Daniel Orton, Philadelphia 76ers
Stephen Jackson, Los Angeles Clippers
Ryan Gomes, Oklahoma City Thunder
Solomon Jones, Orlando Magic
Hamady Ndiaye, Sacramento Kings
Chris Smith, New York Knicks
Al Horford, Atlanta Hawks
John Jenkins, Atlanta Hawks
Brook Lopez, Brooklyn Nets
Michael Harris, Utah Jazz
Kobe Bryant, Los Angeles Lakers
Quincy Pondexter, Memphis Grizzlies
Josh Childress, New Orleans Pelicans
Elias Harris, Los Angeles Lakers
Kwame Brown, Philadelphia 76ers
Jamaal Tinsley, Utah Jazz
JaVale McGee, Denver Nuggets
Kris Joseph, Orlando Magic
Mickell Gladness, Orlando Magic
Romero Osby, Orlando Magic
Eric Griffin, Miami Heat
Brian Cook, Utah Jazz
Dominic McGuire, Utah Jazz
Lester Hudson, Utah Jazz
Scott Machado, Utah Jazz
Jermaine Taylor, Cleveland Cavaliers
Kenny Kadji, Cleveland Cavaliers
Carlos Morais, Toronto Raptors
Tony Gaffney, Memphis Grizzlies
Khalif Wyatt, Philadelphia 76ers
Rodney Williams, Philadelphia 76ers
Chris Johnson, Minnesota Timberwolves
DeSagana Diop, Cleveland Cavaliers
Pops Mensah-Bonsu, Washington Wizards
Xavier Silas, Washington Wizards
CJ Leslie, New York Knicks
Ike Diogu, New York Knicks
Eric Dawson, Atlanta Hawks
Rodney McGruder, Oklahoma City Thunder
Gani Lawal, Philadelphia 76ers
Stephen Graham, Milwaukee Bucks
Trey McKinney Jones, Milwaukee Bucks
Andre Barrett, Memphis Grizzlies
Damen Bell-Holter, Boston Celtics
Kammron Taylor, Boston Celtics
D.J. Kennedy, Dallas Mavericks
Devin Ebanks, Dallas Mavericks
Fab Melo, Dallas Mavericks
Mickey McConnell, Dallas Mavericks
Renaldo Balkman, Dallas Mavericks
Charlie Westbrook, Miami Heat
Dan Nwaelele, San Antonio Spurs
Michael Lee, Cleveland Cavaliers
Marcus Landry, Los Angeles Lakers
Dee Bost, Portland Trail Blazers
EJ Singler, Portland Trail Blazers
Patrick O'Bryant, Charlotte Hornets
Mac Koshwal, Philadelphia 76ers
Courtney Fells, San Antonio Spurs
Gary Forbes, Brooklyn Nets
Trent Lockett, Sacramento Kings
D'or Fischer, Washington Wizards
Olek Czyz, Milwaukee Bucks
Marko Jaric, Brooklyn Nets
Kyle Fogg, Denver Nuggets
Corey Maggette, San Antonio Spurs
Marcus Cousin, San Antonio Spurs
Myck Kabongo, San Antonio Spurs
Ron Howard, Indiana Pacers
Damien Wilkins, Atlanta Hawks
DeShawn Sims, Boston Celtics
Richard Howell, Portland Trail Blazers
Dwayne Jones, Utah Jazz
Brandon Heath, Sacramento Kings
DeQuan Jones, Sacramento Kings
David Lighty, Atlanta Hawks
Cameron Jones, Golden State Warriors
Larry Drew, Miami Heat
Lazar Hayward, New Orleans Pelicans
JaMychal Green, Los Angeles Clippers
Mustapha Farrakhan, Los Angeles Clippers
Damjan Rudez, Indiana Pacers
Ivan Johnson, Dallas Mavericks
Drew Gordon, Philadelphia 76ers
JaKarr Sampson, Philadelphia 76ers
KJ McDaniels, Philadelphia 76ers
Malcolm Lee, Philadelphia 76ers
Devyn Marble, Orlando Magic
Bryce Cotton, San Antonio Spurs
Joshua Davis, San Antonio Spurs
Kyle Anderson, San Antonio Spurs
Andre Dawkins, Miami Heat
Khem Birch, Miami Heat
Shawn Jones, Miami Heat
Tyler Johnson, Miami Heat
CJ Wilcox, Los Angeles Clippers
Erick Green, Denver Nuggets
Gary Harris, Denver Nuggets
Jerrelle Benimon, Denver Nuggets
Jusuf Nurkic, Denver Nuggets
Marcus Williams, Denver Nuggets
Bojan Bogdanovic, Brooklyn Nets
Cory Jefferson, Brooklyn Nets
Jerome Jordan, Brooklyn Nets
Dwight Powell, Boston Celtics
Marcus Smart, Boston Celtics
Christian Watford, Boston Celtics
Tim Frazier, Boston Celtics
Eric Moreland, Sacramento Kings
Nik Stauskas, Sacramento Kings
Trey Johnson, Sacramento Kings
Doug McDermott, Chicago Bulls
Nikola Mirotic, Chicago Bulls
Adreian Payne, Atlanta Hawks
Jarell Eddie, Atlanta Hawks
Brian Qvale, Charlotte Hornets
Dallas Lauderdale, Charlotte Hornets
Justin Cobbs, Charlotte Hornets
Josh Bostic, Detroit Pistons
Kevin Jones, New Orleans Pelicans
Patric Young, New Orleans Pelicans
Russ Smith, New Orleans Pelicans
Richard Solomon, Oklahoma City Thunder
Brendan Haywood, Cleveland Cavaliers
Jason Kapono, Golden State Warriors
Earl Barron, Phoenix Suns
TJ Warren, Phoenix Suns
Tyler Ennis, Phoenix Suns
Nerlens Noel, Philadelphia 76ers
Cleanthony Early, New York Knicks
Orlando Sanchez, New York Knicks
Travis Wear, New York Knicks
Jabari Brown, Los Angeles Lakers
Julius Randle, Los Angeles Lakers
Keith Appling, Los Angeles Lakers
Roscoe Smith, Los Angeles Lakers
Brock Motum, Utah Jazz
Jack Cooley, Utah Jazz
Joey Dorsey, Houston Rockets
Kostas Papanikolaou, Houston Rockets
Nick Johnson, Houston Rockets
Tarik Black, Houston Rockets
Jarnell Stokes, Memphis Grizzlies
Jordan Adams, Memphis Grizzlies
Kalin Lucas, Memphis Grizzlies
Patrick Christopher, Memphis Grizzlies
Jordan Clarkson, Los Angeles Lakers
Shayne Whittington, Indiana Pacers
James Young, Boston Celtics
Lucas Nogueira, Toronto Raptors
Cameron Bairstow, Chicago Bulls
Spencer Dinwiddie, Detroit Pistons
Clint Capela, Houston Rockets
Noah Vonleh, Charlotte Hornets
Zoran Dragic, Phoenix Suns
Thabo Sefolosha, Atlanta Hawks
Kent Bazemore, Atlanta Hawks
Lance Stephenson, Charlotte Hornets
Jason Maxiell, Charlotte Hornets
Hassan Whiteside, Miami Heat
Channing Frye, Orlando Magic
Willie Green, Orlando Magic
Luc Mbah a Moute, Philadelphia 76ers
Alexey Shved, Philadelphia 76ers
Malcolm Thomas, Philadelphia 76ers
Tyler Zeller, Boston Celtics
Marcus Thornton, Boston Celtics
Quincy Acy, New York Knicks
Jose Juan Barea, Dallas Mavericks
Joe Ingles, Utah Jazz
Jason Terry, Houston Rockets
Markel Brown, Brooklyn Nets
Jerami Grant, Philadelphia 76ers
Grant Jerrett, Oklahoma City Thunder
A.J. Price, Cleveland Cavaliers
